{
  "schemaVersion": 1,
  "reviewedAt": "2026-10-28",
  "sources": {
    "compose": "deploy/compose.yaml",
    "composeFiles": [
      "deploy/compose.yaml",
      "deploy/compose.database-identities.yaml",
      "deploy/compose.external-database.yaml",
      "deploy/compose.caddy.yaml",
      "deploy/compose.caddy-public.yaml",
      "deploy/compose.caddy-forwarded.yaml",
      "deploy/compose.smtp-relay.yaml",
      "deploy/compose.stalwart.yaml",
      "deploy/compose.database-tls.yaml",
      "deploy/compose.database-tls-local.yaml",
      "deploy/compose.app-tls.yaml",
      "deploy/compose.external-database-identities.yaml",
      "deploy/compose.database-identities-custom-image.yaml",
      "deploy/compose.custom-image.yaml"
    ],
    "reviewedImages": [
      { "service": "app", "boundaryId": "operator-application-image-acquisition" },
      { "service": "database-migrate", "boundaryId": "operator-application-image-acquisition" },
      { "service": "database-setup", "boundaryId": "operator-application-image-acquisition" },
      { "service": "db", "boundaryId": "operator-docker-hub-image-acquisition" },
      { "service": "log-collector", "boundaryId": "operator-application-image-acquisition" },
      { "service": "mail", "boundaryId": "operator-docker-hub-image-acquisition" },
      { "service": "mail-bootstrap", "boundaryId": "operator-docker-hub-image-acquisition" },
      { "service": "mail-certificate", "boundaryId": "operator-docker-hub-image-acquisition" },
      { "service": "mail-check", "boundaryId": "operator-docker-hub-image-acquisition" },
      { "service": "mail-configure", "boundaryId": "operator-docker-hub-image-acquisition" },
      { "service": "mail-plan", "boundaryId": "operator-docker-hub-image-acquisition" },
      { "service": "mail-reload", "boundaryId": "operator-docker-hub-image-acquisition" },
      { "service": "proxy", "boundaryId": "operator-docker-hub-image-acquisition" }
    ],
    "proxy": "deploy/Caddyfile",
    "application": "src/main/resources/application.yaml",
    "openapi": "src/main/resources/api/openapi.yaml",
    "outboundClientFiles": [
      "deploy/mail-certificate-peer.mjs",
      "deploy/mail-check.sh",
      "deploy/mail-reload.sh",
      "src/main/java/org/courtside/access/internal/LoxoneClient.java",
      "src/main/java/org/courtside/identity/internal/HaveIBeenPwnedPasswordLookup.java",
      "src/main/java/org/courtside/notification/internal/MailDispatch.java",
      "src/main/java/org/courtside/notification/internal/NotificationConfiguration.java",
      "src/main/java/org/courtside/operations/internal/OperationalLogCollector.java",
      "src/main/java/org/courtside/shared/internal/LoopbackReadStep.java",
      "tools/courtside.mail-smoke.mjs"
    ],
    "reviewedNetworkApiFiles": [
      "deploy/mail-certificate-peer.mjs",
      "deploy/mail-check.sh",
      "deploy/mail-reload.sh",
      "src/main/java/org/courtside/access/internal/AccessControlConfiguration.java",
      "src/main/java/org/courtside/access/internal/LoxoneAddress.java",
      "src/main/java/org/courtside/access/internal/LoxoneClient.java",
      "src/main/java/org/courtside/booking/web/BookingController.java",
      "src/main/java/org/courtside/booking/web/DependantBookingController.java",
      "src/main/java/org/courtside/booking/web/SeriesController.java",
      "src/main/java/org/courtside/booking/web/WaitlistController.java",
      "src/main/java/org/courtside/card/web/CardAdminController.java",
      "src/main/java/org/courtside/dataexchange/web/ExternalReferenceAdminController.java",
      "src/main/java/org/courtside/dataexchange/web/ImportPreviewAdminController.java",
      "src/main/java/org/courtside/dataexchange/web/ImportSourceAdminController.java",
      "src/main/java/org/courtside/facility/web/FacilityAdminController.java",
      "src/main/java/org/courtside/identity/internal/HaveIBeenPwnedPasswordLookup.java",
      "src/main/java/org/courtside/identity/internal/MfaKeyRing.java",
      "src/main/java/org/courtside/identity/internal/MfaManagement.java",
      "src/main/java/org/courtside/identity/internal/MfaWebAuthn.java",
      "src/main/java/org/courtside/identity/internal/PasswordPolicyProperties.java",
      "src/main/java/org/courtside/identity/internal/ProblemDetailAccessDeniedHandler.java",
      "src/main/java/org/courtside/identity/internal/ProblemDetailAuthenticationEntryPoint.java",
      "src/main/java/org/courtside/identity/internal/SecurityConfiguration.java",
      "src/main/java/org/courtside/member/web/MembershipTypeAdminController.java",
      "src/main/java/org/courtside/member/web/RosterAdminController.java",
      "src/main/java/org/courtside/notification/internal/InstanceLinks.java",
      "src/main/java/org/courtside/notification/internal/MailDispatch.java",
      "src/main/java/org/courtside/notification/internal/MailHandover.java",
      "src/main/java/org/courtside/notification/internal/MailSettings.java",
      "src/main/java/org/courtside/notification/internal/NotificationConfiguration.java",
      "src/main/java/org/courtside/operations/internal/OperationalLogCollector.java",
      "src/main/java/org/courtside/rules/web/RuleAdminController.java",
      "src/main/java/org/courtside/shared/InstanceAddress.java",
      "src/main/java/org/courtside/shared/ProblemType.java",
      "src/main/java/org/courtside/shared/internal/LoopbackReadStep.java",
      "src/main/java/org/courtside/shared/web/ClientAddress.java",
      "src/main/java/org/courtside/shared/web/ContainerErrorController.java",
      "src/main/java/org/courtside/shared/web/QueryString.java",
      "src/main/java/org/courtside/shared/web/SharedExceptionHandler.java",
      "src/main/java/org/courtside/shared/web/SourceOfferController.java",
      "tools/courtside.mail-smoke.mjs"
    ],
    "configuredTargets": [
      { "target": "application:application.yaml:courtside.mail.host", "productionPath": "src/main/resources/application.yaml", "boundaryIds": ["application-smtp-relay"] },
      { "target": "application:application.yaml:courtside.mail.port", "productionPath": "src/main/resources/application.yaml", "boundaryIds": ["application-smtp-relay"] },
      { "target": "application:application.yaml:courtside.password.breach-endpoint", "productionPath": "src/main/resources/application.yaml", "boundaryIds": ["application-hibp"] },
      { "target": "application:application.yaml:courtside.access-control.loxone.url", "productionPath": "src/main/resources/application.yaml", "boundaryIds": ["application-loxone"] },
      { "target": "application:application.yaml:courtside.public-url", "productionPath": "src/main/resources/application.yaml", "boundaryIds": ["browser-instance-link"] },
      { "target": "application:application.yaml:courtside.source-url", "productionPath": "src/main/resources/application.yaml", "boundaryIds": ["browser-source-navigation"] },
      { "target": "application:application.yaml:management.opentelemetry.tracing.export.otlp.endpoint", "productionPath": "src/main/resources/application.yaml", "boundaryIds": ["application-telemetry"] },
      { "target": "application:application.yaml:management.otlp.metrics.export.url", "productionPath": "src/main/resources/application.yaml", "boundaryIds": ["application-telemetry"] },
      { "target": "compose:app:COURTSIDE_MAIL_RELAY_HOST", "productionPath": "deploy/compose.smtp-relay.yaml", "boundaryIds": ["application-smtp-relay"] },
      { "target": "compose:app:COURTSIDE_MAIL_RELAY_PORT", "productionPath": "deploy/compose.yaml", "boundaryIds": ["application-smtp-relay"] },
      { "target": "compose:app:COURTSIDE_OTLP_METRICS_ENDPOINT", "productionPath": "deploy/compose.yaml", "boundaryIds": ["application-telemetry"] },
      { "target": "compose:app:COURTSIDE_OTLP_TRACES_ENDPOINT", "productionPath": "deploy/compose.yaml", "boundaryIds": ["application-telemetry"] },
      { "target": "compose:app:COURTSIDE_PUBLIC_URL", "productionPath": "deploy/compose.yaml", "boundaryIds": ["browser-instance-link"] },
      { "target": "compose:app:COURTSIDE_SOURCE_URL", "productionPath": "deploy/compose.yaml", "boundaryIds": ["browser-source-navigation"] },
      { "target": "compose:app:SPRING_DATASOURCE_URL", "productionPath": "deploy/compose.yaml", "boundaryIds": ["application-database"] },
      { "target": "compose:database-migrate:SPRING_DATASOURCE_URL", "productionPath": "deploy/compose.database-identities.yaml", "boundaryIds": ["database-migration-database"] },
      { "target": "compose:database-setup:SPRING_DATASOURCE_URL", "productionPath": "deploy/compose.database-identities.yaml", "boundaryIds": ["database-setup-database"] },
      { "target": "compose:mail-bootstrap:STALWART_URL", "productionPath": "deploy/compose.stalwart.yaml", "boundaryIds": ["mail-bootstrap-administration"] },
      { "target": "compose:mail-certificate:COURTSIDE_MAIL_HOSTNAME", "productionPath": "deploy/compose.stalwart.yaml", "boundaryIds": ["proxy-mail-certificate"] },
      { "target": "compose:mail-check:COURTSIDE_MAIL_HOSTNAME", "productionPath": "deploy/compose.stalwart.yaml", "boundaryIds": ["mail-operational-check"] },
      { "target": "compose:mail-check:COURTSIDE_MAIL_OUTBOUND_PROBE", "productionPath": "deploy/compose.stalwart.yaml", "boundaryIds": ["mail-operational-check"] },
      { "target": "compose:mail-check:COURTSIDE_MAIL_RELAY_PROBE", "productionPath": "deploy/compose.stalwart.yaml", "boundaryIds": ["mail-operational-check"] },
      { "target": "compose:mail-check:COURTSIDE_MAIL_RELAY_TARGET", "productionPath": "deploy/compose.stalwart.yaml", "boundaryIds": ["mail-check-mail-reachability"] },
      { "target": "compose:mail-configure:STALWART_URL", "productionPath": "deploy/compose.stalwart.yaml", "boundaryIds": ["mail-configuration-administration"] },
      { "target": "compose:mail-plan:COURTSIDE_MAIL_HOSTNAME", "productionPath": "deploy/compose.stalwart.yaml", "boundaryIds": ["mail-configuration-administration"] },